Ether / IP / TCP 192.168.1.25:53845 > 20.184.175.2:https PA / Raw
Ether / IP / TCP 192.168.1.25:53845 > 20.184.175.2:https PA / Raw
Ether / IP / TCP 192.168.1.25:53845 > 20.184.175.2:https A / Raw
Ether / IP / TCP 192.168.1.25:53845 > 20.184.175.2:https PA / Raw
Ether / IP / UDP 192.168.1.6:37618 > 255.255.255.255:6667 / Raw
Ether / IP / TCP 20.184.175.2:https > 192.168.1.25:53845 A / Padding
Ether / IP / TCP 20.184.175.2:https > 192.168.1.25:53845 A / Padding
Ether / IP / TCP 20.184.175.2:https > 192.168.1.25:53845 PA / Raw
Ether / IP / TCP 192.168.1.25:53845 > 20.184.175.2:https A
Ether / IP / TCP 20.184.175.2:https > 192.168.1.25:53845 PA / Raw
Ether / IP / TCP 192.168.1.25:53845 > 20.184.175.2:https PA / Raw
Ether / IP / TCP 20.184.175.2:https > 192.168.1.25:53845 A / Padding
Ether / IP / UDP 192.168.1.6:37618 > 255.255.255.255:6667 / Raw
Ether / IP / UDP 192.168.1.6:37618 > 255.255.255.255:6667 / Raw
Ether / IP / UDP 192.168.1.6:37618 > 255.255.255.255:6667 / Raw
Ether / IP / UDP 192.168.1.25:56001 > 142.250.199.78:https / Raw
Ether / IP / UDP 192.168.1.25:56001 > 142.250.199.78:https / Raw
Ether / IP / UDP 192.168.1.25:56001 > 142.250.199.78:https / Raw
Ether / Dot1Q / IP / UDP 142.250.199.78:https > 192.168.1.25:56001 / Raw
Ether / Dot1Q / IP / UDP 142.250.199.78:https > 192.168.1.25:56001 / Raw
